No,名前,バージョン,評価,コメント
0125,エレブー,1,★★☆☆☆,雰囲気はあるが、エレブーとはまた全然違った生き物。
0125,エレブー,2,★★★★☆,【再作成】進化前のエレキッドとセットで作成。ビリビリしたリアルなトラっぽくかなり完成度が高くなった。頭の形状がやや異なる。
0126,ブーバー,1,★☆☆☆☆,もはや何の生物かわからない。ビーバーなのかすら怪しい。
0126,ブーバー,2,★★★☆☆,【再作成】進化前のブビィとセットで作成。複数の要素が絡み、難易度が高いわりに完成度は高くなったように思う。
0127,カイロス,1,★★★★★,リアルなクワガタが戦士になったようなカッコよさが全面的に出ている。
0128,ケンタロス,1,★★★☆☆,強そうな闘牛感は出ているが、何かが違うといった感じ。尻尾も1本しかない。
0128,ケンタロス,2,★★★★☆,【再作成】リアルだが、どことなく普通の闘牛感。
0129,コイキング,1,★★★★★,干からびた弱そうなタイを再現できている。
0130,ギャラドス,1,★★★★★,荒れた天気で雷鳴がなっている中で、カッコよく強そうなドラゴンを再現できている。
0131,ラプラス,1,★★★★★,広い海原を優雅に泳ぐ心優しいウミガメのような生物をリアルに表現できている。
0132,メタモン,1,★★★★☆,スライムというよりは固まったプラスチックっぽくなっている。それ以外は完璧。
0133,イーブイ,1,★★★★★,イーブイの雰囲気を出しつつ、実際に飼いたくなるような小動物っぽいかわいさを出せている。
0134,シャワーズ,1,★★★★★,イーブイの面影を残しつつ、イルカやアザラシといった水生生物風の雰囲気を忠実に再現できている。
0135,サンダース,1,★★★★★,毛並みを静電気っぽくたたせることで、触ると危険、感電しますという雰囲気を完璧に表現できている。
0136,ブースター,1,★★★★★,イーブイの雰囲気を残しつつ、湯気をたたせるような自然な感じで、触るとやけどしますという雰囲気を出せている。
0137,ポリゴン,1,★★★★★,金属素材であたかも人によってつくられたようなロボット感を全面に出せている。
0138,オムナイト,1,★★★★☆,リアルなアンモナイトが表現できているが、何かが足りないような気もする。
0139,オムスター,1,★★★☆☆,オムスターではあるが、口元に違和感があり、ちょっと怖い。
0140,カブト,1,★★★☆☆,現実世界のカブトガニを表現されているが、頭の黒点が足りていなかったり、ポケモンのカブトとして不足しているものがある。
0141,カブトプス,1,★★★★☆,現実にいたらびっくりするだろうと思うが、カマの色が茶色かったり何かが足りない。
0142,プテラ,1,★★★★☆,リアルなプテラノドンを再現できている。頭の形がやや異なる。
0143,カビゴン,1,★★☆☆☆,単なるぽっちゃりな食いしん坊のクマにしか見えない。カビゴンとは違った生物。
0144,フリーザー,1,★★★★☆,吹雪の中の幻想的な鳥を表現できている。近づくと凍らされそう。ただ、アニメ寄りになっている。
0145,サンダー,1,★★★★☆,近づくと感電しそうな雰囲気はあるが、全体的にスリム化されている。またアニメ寄り。
0146,ファイヤー,1,★★★☆☆,ファイヤーではあるが、かなりアニメっぽい。体全体が炎でできているように見える。
0147,ミニリュウ,1,★★★★★,かわいらしいヘビっぽい水生ドラゴンを表現できている。
0148,ハクリュー,1,★★★★☆,ヘビっぽい水生ドラゴンを表現できているが、しっぽの青い球に違和感あり。
0149,カイリュー,1,★★★☆☆,カイリューっぽいが、コミカル寄りになってしまった。岩に小さなぬいぐるみが乗っているようにも見え、迫力がない。
0150,ミュウツー,1,★★★★★,ラスボス感が強く、勝ち目がなさそうな最強キャラに仕上がったと思う。ラストにふさわしい最高傑作だと思う。
0151,ミュウ,1,★★★★★,幻ポケモンにふさわしい幻想的な姿に仕上がった。完璧。
