No,名前,バージョン,評価,コメント
0001,フシギダネ,1,★★★☆☆,リアルなカエルに種が生えており、雰囲気は出ているが、種が小さくかわいさが足りない。
0001,フシギダネ,2,★★★★★,【再作成】種の付いたかわいいカエルになり、完成度が高くなった。
0002,フシギソウ,1,★★★★☆,リアルなカエルに蕾が生えており、雰囲気は出ている。
0002,フシギソウ,2,★★★★★,【再作成】ちょっと大人びたカエルになり、蕾の色もきれいになった。
0003,フシギバナ,1,★★★★☆,リアルなカエルに大きな花が生えており、雰囲気は出ているが、何かが不足している。
0003,フシギバナ,2,★★★★☆,【再作成】花に毒毒しさが出て、よりリアルなカエルを表現できたが、どっしり感がちょっと足りない。
0004,ヒトカゲ,1,★★★★☆,リアルな火のついたトカゲが表現できている。2足歩行が良かった。
0004,ヒトカゲ,2,★★★★★,【再作成】かわいい火のついたトカゲをリアルに表現できた。
0005,リザード,1,★★★☆☆,ヒトカゲの進化系と分かるが、なんか違った方向に向いている。頭のとんがりも足りていない。2足歩行であるべき。
0005,リザード,2,★★★★☆,【再作成】リアルな火のついたトカゲを表現できたが、厳つい感じになりすぎた。
0006,リザードン,1,★★☆☆☆,迫力満点なドラゴンになっているが、リザードンとは違うかな。火もついていないし色合いも違う。2足歩行であるべき。
0006,リザードン,2,★★★★★,【再作成】トカゲではなく、リアルな羽の付いた強そうな火竜を表現できた。
0007,ゼニガメ,1,★★★★☆,リアルな子ガメを表現できており、良いと思うが2足歩行だったらよかった。
0007,ゼニガメ,2,★★★★☆,【再作成】かわいい亀をリアルに表現できているが、甲羅が全体を覆っていない。
0008,カメール,1,★★★☆☆,リアルなカメであるが、カメールとは違うかも。頭部のヒラヒラが抜けている。2足歩行が良い。
0008,カメール,2,★★★★☆,【再作成】前よりはリアルなカメールになっているが、甲羅が全体を覆っていない。
0009,カメックス,1,★★★☆☆,もうちょっと迫力が欲しい。パイプが１本しかないので物足りない。2足歩行であるべき。
0009,カメックス,2,★★★★☆,【再作成】どっしりとした亀を表現できたが、甲羅が全体を覆っていないし、水が砲台ではなく、口から吹き出ている(笑)
0010,キャタピー,1,★★★★★,幼虫の気持ち悪さを押さえつつ、リアリティを出せているので、完璧。
0011,トランセル,1,★★★★★,こちらもさなぎの気持ち悪さを押さえつつ、リアルな感じを完璧に表現できている。
0012,バタフリー,1,★★★★☆,完璧に近いが、ちょっと気持ち悪さが出てしまった。もうちょっとかわいい方が良い。
0013,ビードル,1,★★★☆☆,なんかコミカルになりすぎて、おいしそうなお菓子みたいになってしまった。
0014,コクーン,1,★★★☆☆,同じくコミカルになりすぎて、おいしそう。見た目もかわいくなりすぎ。
0015,スピアー,1,★★★★☆,コミカル寄りだが、こちらはリアルな蜂に近いかもしれない。
0016,ポッポ,1,★★★★☆,ポッポぽいが、なんとなくどこにでもいそうな小鳥。
0016,ポッポ,2,★★★★★,【再作成】そのまま小鳥らしさも表現できていて完璧。
0017,ピジョン,1,★★★☆☆,ポッポをそのまま大きくしただけで、どことなく迫力に欠ける。
0017,ピジョン,2,★★★☆☆,【再作成】雰囲気は出しているけど、迫力が足りずピジョンぽくない部分ある。
0018,ピジョット,1,★★★★★,迫力満点な猛禽類になっており、実際にいたら怖いだろうな。
0018,ピジョット,2,★★★★☆,【再作成】迫力のある鳥を再現できたが、目の鋭さが足りない。
0019,コラッタ,1,★★★☆☆,ネズミポケモンが少ないので目立たないが、どこにでもいそうなネズミ。
0019,コラッタ,2,★★★★★,【再作成】コラッタらしさを出しつつ、リアルなネズミとなった。
0020,ラッタ,1,★★★★☆,ラッタの特徴である牙をむき出しにしているので、そういう意味では表現できている。
0020,ラッタ,2,★★★★☆,【再作成】牙むき出しな感じでだいぶリアルに表現できたが、2足歩行でない。
0021,オニスズメ,1,★☆☆☆☆,ポッポとの差別化ができていない。普通の小鳥感。オウムっぽさ？がない。
0021,オニスズメ,2,★★★☆☆,【再作成】前より鋭くなり、ポッポとの差別化はできるようになったが、なんとなくオニスズメっぽく見える程度。
0022,オニドリル,1,★★★★★,鋭いくちばしを最大限に生かせている。
0023,アーボ,1,★★★★★,アーボ自体がどこにでもいそうなヘビなので、それを忠実に再現できている。
0024,アーボック,1,★★★★★,同じくアーボック自体がどこにでもいそうなコブラなので、それを忠実に再現できている。
0025,ピカチュウ,1,★★★★★,リアルな電気をまとったネズミを表現できている。
0026,ライチュウ,1,★★★★★,同じくリアルな電気をまとったネズミを表現できている。
0027,サンド,1,★★★★☆,リアルなアルマジロを表現できているが、２足歩行になってしまったのはちょっと残念。
0027,サンド,2,★★★★★,【再作成】かなりリアルにサンドっぽいアルマジロを再現できてる。
0028,サンドパン,1,★★★☆☆,リアルなとげとげなアルマジロを表現できているが、２足歩行になってしまったのはちょっと残念。鋭い爪も生かせていない。
0028,サンドパン,2,★★★★☆,【再作成】リアルなとげとげなアルマジロを表現できているが、爪や目つきなど鋭さが足りない。
0029,ニドラン♀,1,★★★★★,なかなか表現が難しいポケモンだと思うが、現実にいそうな動物への置き換えが成功していると思う。
0030,ニドリーナ,1,★★☆☆☆,雰囲気は出ているが、ニドラン♀との差別化ができていない。
0031,ニドクイン,1,★★★★★,リアル化が難しいポケモンだと思うが、女王感が出ていて貫禄もある。
0032,ニドラン♂,1,★★★★☆,どことなく、ニドラン♀にも似ている。もっと差別化したい。
0033,ニドリーノ,1,★★☆☆☆,ニドリーナと同じく、ニドラン♂との差別化ができていない。
0034,ニドキング,1,★★☆☆☆,まんまニドクインになってしまった。王様感がなく、王女感が出てしまっている。
0035,ピッピ,1,★★★☆☆,ピッピだとわかるが、何かが違うと思う。
0035,ピッピ,2,★★★☆☆,【再作成】第2世代のピィと合わせて再作成した。ぬいぐるみ感は出ているが、顔と体が分かれており、違和感がある。
0036,ピクシー,1,★☆☆☆☆,別世界からやってきた感はあるが、ピクシーだとわからない。もはや別の生物。
0036,ピクシー,2,★★★☆☆,【再作成】第2世代のピィと合わせて再作成した。ぬいぐるみ感は出ているが、胴体が非常に長くなり、違和感が出てしまった。
0037,ロコン,1,★★★★★,かなりかわいい。ロコンの雰囲気を忠実に再現できている。
0038,キュウコン,1,★★★★☆,ロコンの母親感が出ており良いと思うが、9本のしっぽをより表現できると良い。
0039,プリン,1,★★★☆☆,プリンの雰囲気は出ているが何かが違う。歌っているのであれば、マイクも欲しい。
0039,プリン,2,★★★★☆,【再作成】第2世代のププリンと合わせて再作成した。風船ぽくなりかわいらしさが出た。ちょっとだけ長く、マイクの持ち方に違和感はある。
0040,プクリン,1,★★☆☆☆,なんとなくプクリンなのではないかと分かるが、違う。
0040,プクリン,2,★★★★☆,【再作成】第2世代のププリンと合わせて再作成した。だいぶプクリンぽくなった。後ろの羽根が余計な気がする。
0041,ズバット,1,★☆☆☆☆,見えない。。。洞窟を背景にするのはやめた方がいいかも。拡大してみてもどこにでもいそうなコウモリ感。
0041,ズバット,2,★★☆☆☆,【再作成】第2世代のクロバットと合わせて再作成したが、目が退化ではなく、はにわみたいになり、お化けコウモリ感。。。
0042,ゴルバット,1,★★☆☆☆,ただの凶暴化した大型コウモリなだけで、ゴルバットではない。背景も暗すぎる。
0042,ゴルバット,2,★★★☆☆,【再作成】第2世代のクロバットと合わせて再作成したが、シンボルとなるはずの口のインパクトが弱い。
0043,ナゾノクサ,1,★★★★☆,だいぶリアルに表現できているが、草が細いというか違うというか。
0044,クサイハナ,1,★☆☆☆☆,象徴となるはずの花がない。よだれをたらした何かわからない生物感(笑)。
0044,クサイハナ,2,★★★☆☆,【再作成】前よりだいぶクオリティが上がったが、頭と体が分かれてしまっている。
0045,ラフレシア,1,★★★★★,リアルなラフレシアという毒々しい花を表現できている。
0046,パラス,1,★★★☆☆,片方のキノコがめちゃくちゃでかく、つやつやすぎるので、虫というよりエイリアン感が強い(笑)
0047,パラセクト,1,★★★★★,腐ったキノコ感が出ていて、死んだ魚の目をしているので、キノコに支配された虫感が強く、かなり良い。
0048,コンパン,1,★★★★★,毛玉がリアルで現実にいたら気持ち悪いだろうなと思わせるくらいに忠実に再現できている。
0049,モルフォン,1,★★★★★,現実にいたら気持ち悪いというか怖い蛾をリアルに表現できている。
0050,ディグダ,1,★★★★★,アニメのダグトリオを忠実にリアル化できている。
0051,ダグトリオ,1,★★★★☆,おっさん感が出まくりで、アニメのダグトリオと違うかもしれないが、それがまた面白い。
0052,ニャース,1,★★★★☆,小判がついているリアルな猫なのでニャースと分かるが、2足歩行が良かったかも。
0052,ニャース,2,★★★★★,【再作成】小判がついているリアルな猫でニャースにしか見えないくらいの高クオリティ。
0053,ペルシアン,1,★★★☆☆,雰囲気でペルシアンだとわかるが、どこにでもいそうな猫感。。。
0053,ペルシアン,2,★★★★☆,【再作成】リアルな猫を表現できているが、ペルシアンにある上品さが欠けている。
0054,コダック,1,★★★★★,リアルなアヒルを再現しつつ、頭が痛そうで抱えているさまはコダックそのもの。
0055,ゴルダック,1,★★★★☆,忠実にリアル化できているが、ちょっとマッチョになりすぎた感がある。
0056,マンキー,1,★★★☆☆,胴体が長い。ちょっと人間も混ざっているので、あくまでも獣という前提にした方がいい。
0056,マンキー,2,★★★★★,【再作成】全く違和感なく、自然にいそうなブタザルを表現できている。
0057,オコリザル,1,★★☆☆☆,頭は獣、体は人間になっているので、あくまでも頭から直で獣の手と足が生えている感じにしたい。
0057,オコリザル,2,★★★★★,【再作成】マンキーと同様に2回目で違和感のない仕上がりとなり、完成度が非常に高くなった。
0058,ガーディ,1,★★★★★,ガーディを忠実に再現しつつ、ペットにしたくなるような可愛さが出まくっている。
0059,ウインディ,1,★★★★☆,空想上の生き物に近くなっており良い感じだが、ちょっとウインディの雰囲気とは違うかも。
0060,ニョロモ,1,★☆☆☆☆,何かが気持ち悪い。もっとかわいさが欲しい。頭はいらない。胴体に目と口がついている感じにした良い。
0060,ニョロモ,2,★★☆☆☆,【再作成】かわいらしくはなったが、いろいろとアニメ版と何かが違う。
0061,ニョロゾ,1,★★☆☆☆,ニョロゾの雰囲気は出ているが、頭と胴体を分ける必要はない。手袋みたいなものがない。
0061,ニョロゾ,2,★★★☆☆,【再作成】こちらも前よりかわいくなったが、頭と胴体が分かれているので、違和感あり。
0062,ニョロボン,1,★★☆☆☆,ニョロボンのマッチョな雰囲気は出ているが、頭と胴体を分ける必要はない。
0063,ケーシィ,1,★★★☆☆,瞑想している狐感が強く出ていて雰囲気はあるが、何かが違う。
0064,ユンゲラー,1,★★★☆☆,片手にスプーンを持っており、ユンゲラーっぽくなっているが、何かが違う。
0065,フーディン,1,★★★☆☆,両手にスプーンを持っている仙人感が出ているが、何かが違う。
0066,ワンリキー,1,★★☆☆☆,気持ち悪さが出てしまっている。もっと子供というかわんぱく感がほしい。
0066,ワンリキー,2,★★★★★,【再作成】石像ベースに、かわいくてわんぱくな子供を完璧に表現できた。
0067,ゴーリキー,1,★★☆☆☆,おっさん感が強すぎる。もっとかっこいい雰囲気を出したい。
0067,ゴーリキー,2,★★★☆☆,【再作成】おっさんぽくてなにかが違う。
0068,カイリキー,1,★★☆☆☆,肝心の腕が2本しかない。4本ないとカイリキーではない。見た目も怖すぎる。
0068,カイリキー,2,★★★☆☆,【再作成】見た目は完璧だが、腕が2本しかないのがマイナスポイント。
0069,マダツボミ,1,★★★☆☆,ちょっとウツドンとも混ざってしまったか。茎が短いので違和感ある。
0069,マダツボミ,2,★★★★☆,【再作成】前回よりはだいぶ雰囲気が出てきたが、頭の形状が違う。
0070,ウツドン,1,★★★☆☆,両脇に葉っぱがなく、目のインパクトも弱い。
0070,ウツドン,2,★★★☆☆,【再作成】ウツドンっぽくなったが、形状が異なる。頭も葉っぱではなく、茶色い茎が正しい
0071,ウツボット,1,★☆☆☆☆,原型をとどめておらず、別の生き物にしか見えない。そもそもウツボカズラという植物がマイナーなので表現が難しいか。
0071,ウツボット,2,★☆☆☆☆,【再作成】現物のウツボカズラに似せようとしたが、どうしても大きく遠ざかってしまう。もはやネタ枠(笑)
0072,メノクラゲ,1,★★☆☆☆,雰囲気はあるが、なんとなく宇宙からやってきたエイリアン感がある。赤いゼリー状のものの配置もおかしい。ドククラゲと似通っている。
0073,ドククラゲ,1,★★★★☆,かなりリアルに再現できていると思うが、足の数が多すぎるように思う。
0074,イシツブテ,1,★★★★★,ごつごつした石を忠実に再現できている。
0075,ゴローン,1,★★★★☆,ごつごつした岩感は再現できているが、マッチョすぎてちょっと違和感あり。
0076,ゴローニャ,1,★★★☆☆,背景が暗いせいかインパクトに欠ける。腕もないように見えて、ゴローンより弱そう。
0077,ポニータ,1,★★★★★,火のついたポニーを再現できており、リアリティが強い。
0078,ギャロップ,1,★★★★★,空想上の生き物だが、現実にいたらインパクト大。
0079,ヤドン,1,★★★★☆,肌の質感がかなりリアルで気持ち悪さが出ているが、もううちょっとのんびりしたマヌケ感を出してもよい。
0079,ヤドン,2,★★★★★,【再作成】初回からかなり完成度が上がった。のんびりしたマヌケ感が出ていて良い。
0080,ヤドラン,1,★★★★☆,肌の質感がリアルで後ろの貝殻もリアルだが、マヌケ感を出しつつ、貝殻には目をつけたい。
0080,ヤドラン,2,★★★★☆,【再作成】完成度はかなり高くなったが、お腹の模様の位置が違う。
0081,コイル,1,★★★★★,金属＋磁石の光沢がリアルすぎる。目力もすごい。現実にいそうな感じが出ている。
0082,レアコイル,1,★★★★★,コイルと同上で、金属＋磁石の光沢がリアルすぎる。現実にいそうな感じが出ている。
0083,カモネギ,1,★★★★☆,リアルなネギをもったカモを忠実に再現できているが、ちょっとアニメ感が出てしまった。
0083,カモネギ,2,★★★★☆,【再作成】リアルなネギを背負ったカモを再現できたが、普通のカモ感もある。
0084,ドードー,1,★★★★☆,現実にいないような鳥を再現できているが、アニメ感がちょっと強い。
0085,ドードリオ,1,★★★☆☆,アニメ感が強く、首も1本足りていない。
0086,パウワウ,1,★★★★★,現実にいそうなかわいいアザラシに置き換えられており、水族館の人気者感が全面的に押し出されている。
0087,ジュゴン,1,★★☆☆☆,普通のアザラシ感が出ており、パウワウとの差別化もできていない感じがする。
0088,ベトベター,1,★★★☆☆,汚いヘドロをリアルに再現できているが、ベトベトンとの差別化がいまいち。
0089,ベトベトン,1,★★★☆☆,同じく汚いヘドロをリアルに再現できているが、ベトベターとの差別化がいまいち。
0090,シェルダー,1,★★★★★,ホタテっぽい貝殻に舌を出した顔をのぞかせるような現実にいない生物をリアルに再現できている。
0091,パルシェン,1,★★★★★,大シャコガイから目の付いた顔をのぞかせるというこれも現実にいないような生物をリアルに再現できている。
0092,ゴース,1,★★★☆☆,ゴースだとわかり、毒ガス感も全面的に押し出せているが、背景が暗いからかいまいちな部分がある。
0093,ゴースト,1,★★☆☆☆,どこにでもいそうなお化け感が強く、ぱっと見でゴーストと分かりにくい。
0094,ゲンガー,1,★★★☆☆,ゲンガーということがわかるが、インパクトが弱い。
0095,イワーク,1,★★★☆☆,イワークということがわかり、ごつごつした岩ヘビを表現できているが、何かが足りない。
0095,イワーク,2,★★★★★,【再作成】第2世代のハガネールと合わせて再作成。岩のごつごつ感をリアルに再現できた。
0096,スリープ,1,★★★★☆,リアルな2足歩行の獏を再現できているがちょっとスリム。
0097,スリーパー,1,★★☆☆☆,狐感が強く出てしまった。右手に持っている振り子が時計になっている(笑)。
0098,クラブ,1,★☆☆☆☆,カニであることはわかるが、目が飛び出ていて、ハサミも協調されていないので、全然違った生物になっている。
0099,キングラー,1,★★★☆☆,大きなハサミでなんとかキングラーっぽくなっているが、ハサミが1本足りないし、全体的にキングラーの模様とは違う感じ。
0100,ビリリダマ,1,★★★★★,プラスチック感が強く出ていて、触るとと感電しそうな感じも強く出ている。
0101,マルマイン,1,★★★★★,同じくプラスチック感が出ていて、触ると危険であることがわかりそうな見た目。
0102,タマタマ,1,★★★☆☆,集まっているのでタマタマと分かるが、色合いが全然違い、表情や形も全部同じように見える。割れた卵やひびが入った卵も欲しい。
0103,ナッシー,1,★★★★☆,良い感じになっているが、だいぶイラスト寄りになった
0104,カラカラ,1,★★★☆☆,ガラガラっぽくも見える。怖い。
0105,ガラガラ,1,★★★☆☆,リアルになりすぎて、怖すぎる。体型もマッチョになりすぎ。
0106,サワムラー,1,★☆☆☆☆,頭と胴体が分かれており、細長すぎて、どこの宇宙人かと思うような見た目になってしまっている。
0106,サワムラー,2,★☆☆☆☆,【再作成】2世代のバルキー・カポエラーとセットで再作成。どうしてもサワムラー感が出せない。。。
0106,サワムラー,3,★★★★★,【再々作成】2世代のバルキー・カポエラーとセットで再々作成。人型から切り離し、ばね付きロボットをベースにビニール袋をかぶせる感じで生成すると大成功。
0107,エビワラー,1,★☆☆☆☆,どこにでもいそうなボクサーになっており、エビワラー感がゼロ。
0107,エビワラー,2,★★★★★,【再作成】2世代のバルキー・カポエラーとセットで再作成。なぜか一気に完成度が上がった。体は人間で頭だけ異形な感じを表現できた。
0108,ベロリンガ,1,★★★★☆,リアルな肌感で気持ち悪さが全面的に押し出されている。2足歩行であれば良かった。
0109,ドガース,1,★★★★☆,毒がたっぷり詰まった風船のようなものをリアルに再現できており、そこから汚染されそうな毒ガスが吹き出ているのが良い。ちょっとマタドガス寄りのルックスにも見える。
0110,マタドガス,1,★★★★☆,ドガースをさらに老化させて、干からびた感が出ているので良い。象徴のどくろマークが消えている。
0111,サイホーン,1,★★★★☆,強そうなリアルなサイを再現できている。足がちょっと長くスリムな感じになっている。
0112,サイドン,1,★★★☆☆,強そうな2足歩行のサイではあるが、サイドンとは遠ざかりつつある。
0113,ラッキー,1,★★★★☆,良い感じになっているが、もうちょっとリアルっぽさが欲しい
0114,モンジャラ,1,★★★★☆,もうちょっとリアルなツルを表現したい。
0115,ガルーラ,1,★★★☆☆,カンガルーではあるが、ガルーラはもっとどっしりしている。スリムになりすぎている。
0115,ガルーラ,2,★★★★★,【再作成】まさにカンガルーと怪獣の融合生物をリアルに表現できてる。
0116,タッツー,1,★★★★★,リアルなタツノオトシゴを再現しつつ、かわいさも出せているので、完璧。
0117,シードラ,1,★★★★★,リアルなかっこいいタツノオトシゴを完璧に再現できている。
0118,トサキント,1,★★★★★,現実世界にいそうな金魚に角をつけることでトサキントを忠実に再現できている。
0119,アズマオウ,1,★★★★★,現実世界にいそうな金魚に角をつけることでアズマオウを忠実に再現できている。金魚の王様感を強く表現できている。
0120,ヒトデマン,1,★★★★★,金ピカなロボットヒトデっぽくなっており完璧。真ん中のビー玉もリアルな感じで輝いている。
0121,スターミー,1,★★★★★,銀色に光ったロボットヒトデ感が非常に強い。真ん中の宝石も現実のきれいな宝石をはめ込んだ感じで自然な感じに輝いている。完璧。
0122,バリヤード,1,★★☆☆☆,おじさんがコスプレをしているようにしか見えない。
0123,ストライク,1,★★★★★,リアルなカマキリが戦士になったようなカッコよさが全面的に出ている。
0124,ルージュラ,1,★★★☆☆,コミカルっぽさが強く出てしまった。体型は婦人＋顔がコミカルさが強い化け物みたいな感じ。
0124,ルージュラ,2,★★★★☆,【再作成】進化前のムチュールとセットで作成。完成度は上がったがまんまアニメという感じ。
0124,ルージュラ,3,★★★★★,【再々作成】進化前のムチュールとセットで作成。人型にこだわらない異形方向でやると、再現度がかなり高くなった。
